post_id,post_title,URL,Date,Score
1izoqum,Match Thread: West Ham United vs Leicester City | English Premier League,https://www.reddit.com/r/soccer/comments/1izoqum/match_thread_west_ham_united_vs_leicester_city/,27/02/2025,Unknown
1iywufn,Match Thread: Liverpool vs Newcastle United | English Premier League,https://www.reddit.com/r/soccer/comments/1iywufn/match_thread_liverpool_vs_newcastle_united/,26/02/2025,Unknown
1iywa07,Match Thread: Manchester United vs Ipswich Town | English Premier League,https://www.reddit.com/r/soccer/comments/1iywa07/match_thread_manchester_united_vs_ipswich_town/,26/02/2025,Unknown
1iyvxzb,Match Thread: Brentford vs Everton | English Premier League,https://www.reddit.com/r/soccer/comments/1iyvxzb/match_thread_brentford_vs_everton_english_premier/,26/02/2025,Unknown
1iyvxty,Match Thread: Nottingham Forest vs Arsenal | English Premier League,https://www.reddit.com/r/soccer/comments/1iyvxty/match_thread_nottingham_forest_vs_arsenal_english/,26/02/2025,Unknown
1iyvpxf,Match Thread: Tottenham Hotspur vs Manchester City | English Premier League,https://www.reddit.com/r/soccer/comments/1iyvpxf/match_thread_tottenham_hotspur_vs_manchester_city/,26/02/2025,Unknown
1iy52je,Match Thread: Chelsea vs Southampton | English Premier League,https://www.reddit.com/r/soccer/comments/1iy52je/match_thread_chelsea_vs_southampton_english/,25/02/2025,Unknown
1iy3vg3,Match Thread: Wolverhampton Wanderers vs Fulham | English Premier League,https://www.reddit.com/r/soccer/comments/1iy3vg3/match_thread_wolverhampton_wanderers_vs_fulham/,25/02/2025,Unknown
1iy3aa6,Match Thread: Crystal Palace vs Aston Villa | English Premier League,https://www.reddit.com/r/soccer/comments/1iy3aa6/match_thread_crystal_palace_vs_aston_villa/,25/02/2025,Unknown
1iwdwyh,Match Thread: Manchester City vs Liverpool | English Premier League,https://www.reddit.com/r/soccer/comments/1iwdwyh/match_thread_manchester_city_vs_liverpool_english/,23/02/2025,Unknown
1iwaqjx,Match Thread: Newcastle United vs Nottingham Forest | English Premier League,https://www.reddit.com/r/soccer/comments/1iwaqjx/match_thread_newcastle_united_vs_nottingham/,23/02/2025,Unknown
1ivnlx9,Match Thread: Aston Villa vs Chelsea | English Premier League,https://www.reddit.com/r/chelseafc/comments/1ivnlx9/match_thread_aston_villa_vs_chelsea_english/,22/02/2025,Unknown
1ivkubk,Match Thread: Arsenal vs West Ham United | English Premier League,https://www.reddit.com/r/soccer/comments/1ivkubk/match_thread_arsenal_vs_west_ham_united_english/,22/02/2025,Unknown
1ivkm4d,Match Thread: Southampton vs Brighton & Hove Albion | English Premier League,https://www.reddit.com/r/SaintsFC/comments/1ivkm4d/match_thread_southampton_vs_brighton_hove_albion/,22/02/2025,Unknown
1ivkipt,Match Thread: Fulham vs Crystal Palace | English Premier League,https://www.reddit.com/r/fulhamfc/comments/1ivkipt/match_thread_fulham_vs_crystal_palace_english/,22/02/2025,Unknown
1ivkh76,Match Thread: Ipswich Town vs Tottenham Hotspur | English Premier League,https://www.reddit.com/r/soccer/comments/1ivkh76/match_thread_ipswich_town_vs_tottenham_hotspur/,22/02/2025,Unknown
1ivkggl,Match Thread: AFC Bournemouth vs Wolverhampton Wanderers | English Premier League,https://www.reddit.com/r/soccer/comments/1ivkggl/match_thread_afc_bournemouth_vs_wolverhampton/,22/02/2025,Unknown
1ivhrea,Match Thread: Everton vs Manchester United | English Premier League,https://www.reddit.com/r/reddevils/comments/1ivhrea/match_thread_everton_vs_manchester_united_english/,22/02/2025,Unknown
1iuzvt5,Match Thread: Leicester City vs Brentford | English Premier League,https://www.reddit.com/r/soccer/comments/1iuzvt5/match_thread_leicester_city_vs_brentford_english/,21/02/2025,Unknown
1itebv1,Match Thread: Aston Villa vs Liverpool | English Premier League,https://www.reddit.com/r/soccer/comments/1itebv1/match_thread_aston_villa_vs_liverpool_english/,19/02/2025,Unknown
1iqwxpq,Match Thread: Tottenham Hotspur vs Manchester United | English Premier League,https://www.reddit.com/r/ManUtd/comments/1iqwxpq/match_thread_tottenham_hotspur_vs_manchester/,16/02/2025,Unknown
1iqsmxw,Match Thread: Liverpool vs Wolverhampton Wanderers | English Premier League,https://www.reddit.com/r/soccer/comments/1iqsmxw/match_thread_liverpool_vs_wolverhampton_wanderers/,16/02/2025,Unknown
1iq3jfx,Match Thread: Fulham vs Nottingham Forest | English Premier League,https://www.reddit.com/r/fulhamfc/comments/1iq3jfx/match_thread_fulham_vs_nottingham_forest_english/,15/02/2025,Unknown
1iq3frv,Match Thread: West Ham United vs Brentford | English Premier League,https://www.reddit.com/r/soccer/comments/1iq3frv/match_thread_west_ham_united_vs_brentford_english/,15/02/2025,Unknown
1iq39ec,Match Thread: Manchester City vs Newcastle United | English Premier League,https://www.reddit.com/r/soccer/comments/1iq39ec/match_thread_manchester_city_vs_newcastle_united/,15/02/2025,Unknown
1iq34cj,Match Thread: Southampton vs AFC Bournemouth | English Premier League,https://www.reddit.com/r/SaintsFC/comments/1iq34cj/match_thread_southampton_vs_afc_bournemouth/,15/02/2025,Unknown
1iq3476,Match Thread: Aston Villa vs Ipswich Town | English Premier League,https://www.reddit.com/r/soccer/comments/1iq3476/match_thread_aston_villa_vs_ipswich_town_english/,15/02/2025,Unknown
1iq078e,Match Thread: Leicester City vs Arsenal | English Premier League,https://www.reddit.com/r/soccer/comments/1iq078e/match_thread_leicester_city_vs_arsenal_english/,15/02/2025,Unknown
1ipjscx,Match Thread: Brighton & Hove Albion vs Chelsea | English Premier League,https://www.reddit.com/r/soccer/comments/1ipjscx/match_thread_brighton_hove_albion_vs_chelsea/,14/02/2025,Unknown
1igyam0,Match Thread: Chelsea vs West Ham United | English Premier League,https://www.reddit.com/r/soccer/comments/1igyam0/match_thread_chelsea_vs_west_ham_united_english/,03/02/2025,Unknown
1ify7m7,Match Thread: Manchester United vs Crystal Palace | English Premier League,https://www.reddit.com/r/ManUtd/comments/1ify7m7/match_thread_manchester_united_vs_crystal_palace/,02/02/2025,Unknown
1ifxrwf,Match Thread: Brentford vs Tottenham Hotspur | English Premier League,https://www.reddit.com/r/soccer/comments/1ifxrwf/match_thread_brentford_vs_tottenham_hotspur/,02/02/2025,Unknown
1ifb14v,Match Thread: Wolverhampton Wanderers vs Aston Villa | English Premier League,https://www.reddit.com/r/soccer/comments/1ifb14v/match_thread_wolverhampton_wanderers_vs_aston/,01/02/2025,Unknown
1if8exm,Match Thread: Ipswich Town vs Southampton | English Premier League,https://www.reddit.com/r/soccer/comments/1if8exm/match_thread_ipswich_town_vs_southampton_english/,01/02/2025,Unknown
1if805l,Match Thread: Newcastle United vs Fulham | English Premier League,https://www.reddit.com/r/fulhamfc/comments/1if805l/match_thread_newcastle_united_vs_fulham_english/,01/02/2025,Unknown
1if7wzb,Match Thread: Everton vs Leicester City | English Premier League,https://www.reddit.com/r/soccer/comments/1if7wzb/match_thread_everton_vs_leicester_city_english/,01/02/2025,Unknown
1if7u5b,Match Thread: AFC Bournemouth vs Liverpool | English Premier League,https://www.reddit.com/r/soccer/comments/1if7u5b/match_thread_afc_bournemouth_vs_liverpool_english/,01/02/2025,Unknown
1if53oa,Match Thread: Nottingham Forest vs Brighton & Hove Albion | English Premier League,https://www.reddit.com/r/soccer/comments/1if53oa/match_thread_nottingham_forest_vs_brighton_hove/,01/02/2025,Unknown
1iaovl9,Match Thread: Fulham vs Manchester United | English Premier League,https://www.reddit.com/r/fulhamfc/comments/1iaovl9/match_thread_fulham_vs_manchester_united_english/,26/01/2025,Unknown
1iaj0aw,Match Thread: Aston Villa vs West Ham United | English Premier League,https://www.reddit.com/r/soccer/comments/1iaj0aw/match_thread_aston_villa_vs_west_ham_united/,26/01/2025,Unknown
1iafifa,Match Thread: Tottenham Hotspur vs Leicester City | English Premier League,https://www.reddit.com/r/soccer/comments/1iafifa/match_thread_tottenham_hotspur_vs_leicester_city/,26/01/2025,Unknown
1iaf8k2,Match Thread: Crystal Palace vs Brentford | English Premier League,https://www.reddit.com/r/soccer/comments/1iaf8k2/match_thread_crystal_palace_vs_brentford_english/,26/01/2025,Unknown
1i9rqi8,Match Thread: Manchester City vs Chelsea | English Premier League,https://www.reddit.com/r/chelseafc/comments/1i9rqi8/match_thread_manchester_city_vs_chelsea_english/,25/01/2025,Unknown
1i9p654,Match Thread: Southampton vs Newcastle United | English Premier League,https://www.reddit.com/r/soccer/comments/1i9p654/match_thread_southampton_vs_newcastle_united/,25/01/2025,Unknown
1i9ow68,Match Thread: AFC Bournemouth vs Nottingham Forest | English Premier League,https://www.reddit.com/r/soccer/comments/1i9ow68/match_thread_afc_bournemouth_vs_nottingham_forest/,25/01/2025,Unknown
1i9ow1b,Match Thread: Wolverhampton Wanderers vs Arsenal | English Premier League,https://www.reddit.com/r/soccer/comments/1i9ow1b/match_thread_wolverhampton_wanderers_vs_arsenal/,25/01/2025,Unknown
1i9oubb,Match Thread: Brighton & Hove Albion vs Everton | English Premier League,https://www.reddit.com/r/BrightonHoveAlbion/comments/1i9oubb/match_thread_brighton_hove_albion_vs_everton/,25/01/2025,Unknown
1i9ou7f,Match Thread: Liverpool vs Ipswich Town | English Premier League,https://www.reddit.com/r/soccer/comments/1i9ou7f/match_thread_liverpool_vs_ipswich_town_english/,25/01/2025,Unknown
1i5z0c6,Match Thread: Chelsea vs Wolverhampton Wanderers | English Premier League,https://www.reddit.com/r/chelseafc/comments/1i5z0c6/match_thread_chelsea_vs_wolverhampton_wanderers/,20/01/2025,Unknown
1i52exc,Match Thread: Ipswich Town vs Manchester City | English Premier League,https://www.reddit.com/r/soccer/comments/1i52exc/match_thread_ipswich_town_vs_manchester_city/,19/01/2025,Unknown
1i4z4n0,Match Thread: Everton vs Tottenham Hotspur | English Premier League,https://www.reddit.com/r/soccer/comments/1i4z4n0/match_thread_everton_vs_tottenham_hotspur_english/,19/01/2025,Unknown
1i4z1fb,Match Thread: Manchester United vs Brighton & Hove Albion | English Premier League,https://www.reddit.com/r/reddevils/comments/1i4z1fb/match_thread_manchester_united_vs_brighton_hove/,19/01/2025,Unknown
1i4z1bs,Match Thread: Nottingham Forest vs Southampton | English Premier League,https://www.reddit.com/r/SaintsFC/comments/1i4z1bs/match_thread_nottingham_forest_vs_southampton/,19/01/2025,Unknown
1i49fyn,Match Thread: West Ham United vs Crystal Palace | English Premier League,https://www.reddit.com/r/soccer/comments/1i49fyn/match_thread_west_ham_united_vs_crystal_palace/,18/01/2025,Unknown
1i498gn,Match Thread: Leicester City vs Fulham | English Premier League,https://www.reddit.com/r/fulhamfc/comments/1i498gn/match_thread_leicester_city_vs_fulham_english/,18/01/2025,Unknown
1i46ljf,Match Thread: Newcastle United vs AFC Bournemouth | English Premier League,https://www.reddit.com/r/soccer/comments/1i46ljf/match_thread_newcastle_united_vs_afc_bournemouth/,18/01/2025,Unknown
1i2xqpv,Match Thread: Manchester United vs Southampton | English Premier League,https://www.reddit.com/r/reddevils/comments/1i2xqpv/match_thread_manchester_united_vs_southampton/,16/01/2025,Unknown
1i2x5zf,Match Thread: Ipswich Town vs Brighton & Hove Albion | English Premier League,https://www.reddit.com/r/soccer/comments/1i2x5zf/match_thread_ipswich_town_vs_brighton_hove_albion/,16/01/2025,Unknown
1i25ofq,Match Thread: Newcastle United vs Wolverhampton Wanderers | English Premier League,https://www.reddit.com/r/soccer/comments/1i25ofq/match_thread_newcastle_united_vs_wolverhampton/,15/01/2025,Unknown
1i25l0c,Match Thread: Leicester City vs Crystal Palace | English Premier League,https://www.reddit.com/r/soccer/comments/1i25l0c/match_thread_leicester_city_vs_crystal_palace/,15/01/2025,Unknown
1i25hky,Match Thread: Everton vs Aston Villa | English Premier League,https://www.reddit.com/r/soccer/comments/1i25hky/match_thread_everton_vs_aston_villa_english/,15/01/2025,Unknown
1i1ex0d,Match Thread: Chelsea vs AFC Bournemouth | English Premier League,https://www.reddit.com/r/soccer/comments/1i1ex0d/match_thread_chelsea_vs_afc_bournemouth_english/,14/01/2025,Unknown
1i1erbz,Match Thread: Nottingham Forest vs Liverpool | English Premier League,https://www.reddit.com/r/soccer/comments/1i1erbz/match_thread_nottingham_forest_vs_liverpool/,14/01/2025,Unknown
1i1e9oq,Match Thread: West Ham United vs Fulham | English Premier League,https://www.reddit.com/r/soccer/comments/1i1e9oq/match_thread_west_ham_united_vs_fulham_english/,14/01/2025,Unknown
1i1e1ry,Match Thread: Brentford vs Manchester City | English Premier League,https://www.reddit.com/r/soccer/comments/1i1e1ry/match_thread_brentford_vs_manchester_city_english/,14/01/2025,Unknown
1hudcoz,Match Thread: Liverpool vs Manchester United | English Premier League,https://www.reddit.com/r/ManUtd/comments/1hudcoz/match_thread_liverpool_vs_manchester_united/,05/01/2025,Unknown
1hu7tm8,Match Thread: Fulham vs Ipswich Town | English Premier League,https://www.reddit.com/r/fulhamfc/comments/1hu7tm8/match_thread_fulham_vs_ipswich_town_english/,05/01/2025,Unknown
1htjedx,Match Thread: Brighton & Hove Albion vs Arsenal | English Premier League,https://www.reddit.com/r/soccer/comments/1htjedx/match_thread_brighton_hove_albion_vs_arsenal/,04/01/2025,Unknown
1htgqf8,Match Thread: Southampton vs Brentford | English Premier League,https://www.reddit.com/r/soccer/comments/1htgqf8/match_thread_southampton_vs_brentford_english/,04/01/2025,Unknown
1htghaa,Match Thread: Manchester City vs West Ham United | English Premier League,https://www.reddit.com/r/soccer/comments/1htghaa/match_thread_manchester_city_vs_west_ham_united/,04/01/2025,Unknown
1htg49f,Match Thread: Crystal Palace vs Chelsea | English Premier League,https://www.reddit.com/r/soccer/comments/1htg49f/match_thread_crystal_palace_vs_chelsea_english/,04/01/2025,Unknown
1htg43w,Match Thread: AFC Bournemouth vs Everton | English Premier League,https://www.reddit.com/r/soccer/comments/1htg43w/match_thread_afc_bournemouth_vs_everton_english/,04/01/2025,Unknown
1htfzin,Match Thread: Aston Villa vs Leicester City | English Premier League,https://www.reddit.com/r/soccer/comments/1htfzin/match_thread_aston_villa_vs_leicester_city/,04/01/2025,Unknown
1htdcz4,Match Thread: Tottenham Hotspur vs Newcastle United | English Premier League,https://www.reddit.com/r/soccer/comments/1htdcz4/match_thread_tottenham_hotspur_vs_newcastle/,04/01/2025,Unknown
1hr7kdb,Match Thread: Brentford vs Arsenal | English Premier League,https://www.reddit.com/r/soccer/comments/1hr7kdb/match_thread_brentford_vs_arsenal_english_premier/,01/01/2025,Unknown
